{
  "$schema": "http://json-schema.org/draft-07/schema#",
  "$id": "https://evolith.dev/schema/topology-manifest.schema.json",
  "title": "Evolith Topology Manifest",
  "description": "JSON Schema for validating topology.manifest.json files in the Multi-Topology Reference Corpus. The manifest is technical-only and exposes topology context for CLI, MCP, and Service CORE API resolution.",
  "type": "object",
  "required": ["apiVersion", "kind", "metadata", "spec", "businessBoundary"],
  "additionalProperties": false,
  "properties": {
    "apiVersion": {
      "type": "string",
      "const": "evolith.dev/topology/v1",
      "description": "Topology manifest API version."
    },
    "kind": {
      "type": "string",
      "const": "TopologyManifest",
      "description": "Manifest kind."
    },
    "metadata": {
      "type": "object",
      "required": ["id", "name", "dimension", "status", "version"],
      "additionalProperties": false,
      "properties": {
        "id": {
          "type": "string",
          "pattern": "^[a-z0-9]+(?:-[a-z0-9]+)*$",
          "description": "Stable topology identifier in kebab-case, for example modular-monolith, serverless, data-mesh, or agentic-ai."
        },
        "name": {
          "type": "string",
          "minLength": 3,
          "description": "Human-readable topology name."
        },
        "dimension": {
          "type": "string",
          "enum": ["progressive-axis", "execution", "integration", "data", "ai"],
          "description": "Dimensional family for this topology profile."
        },
        "status": {
          "type": "string",
          "enum": ["draft", "proposed", "accepted", "deprecated"],
          "description": "Governance status of the topology profile."
        },
        "version": {
          "type": "string",
          "pattern": "^\\d+\\.\\d+\\.\\d+$",
          "description": "Semantic version of the topology manifest contract instance."
        }
      }
    },
    "spec": {
      "type": "object",
      "required": [
        "summary",
        "topologyType",
        "compatibility",
        "artifacts",
        "operationalInterfaces"
      ],
      "additionalProperties": false,
      "properties": {
        "summary": {
          "type": "string",
          "minLength": 20,
          "description": "Technical purpose and applicability of the topology."
        },
        "topologyType": {
          "type": "string",
          "enum": [
            "modular-monolith",
            "distributed-modules",
            "microservices",
            "serverless",
            "edge-computing",
            "event-driven",
            "data-mesh",
            "agentic-ai"
          ],
          "description": "Canonical topology archetype governed by this manifest."
        },
        "compatibility": {
          "type": "object",
          "required": ["progressiveAxis", "composableWith"],
          "additionalProperties": false,
          "properties": {
            "progressiveAxis": {
              "type": "object",
              "required": ["phase", "profile"],
              "additionalProperties": false,
              "properties": {
                "phase": {
                  "type": "string",
                  "enum": ["F1", "F2", "F3", "cross"],
                  "description": "Progressive architecture compatibility phase. Use cross for topologies that combine with multiple F1/F2/F3 phases."
                },
                "profile": {
                  "type": "string",
                  "enum": ["modular-monolith", "distributed-modules", "microservices", "cross"],
                  "description": "Compatibility mapping for the progressive-axis model."
                }
              }
            },
            "composableWith": {
              "type": "array",
              "items": {
                "type": "string",
                "pattern": "^[a-z0-9]+(?:-[a-z0-9]+)*$"
              },
              "uniqueItems": true,
              "description": "Topology identifiers that can be combined with this manifest."
            }
          }
        },
        "artifacts": {
          "type": "object",
          "required": ["adrs", "rulesets", "opaPolicies", "aiRulesets", "umsContracts"],
          "additionalProperties": false,
          "properties": {
            "adrs": {
              "type": "array",
              "items": { "$ref": "#/definitions/repositoryPath" },
              "uniqueItems": true,
              "description": "Accepted or draft ADRs governing this topology."
            },
            "rulesets": {
              "type": "array",
              "items": { "$ref": "#/definitions/repositoryPath" },
              "uniqueItems": true,
              "description": "Native machine-readable rulesets for this topology."
            },
            "opaPolicies": {
              "type": "array",
              "items": { "$ref": "#/definitions/repositoryPath" },
              "uniqueItems": true,
              "description": "OPA/Rego policies for this topology."
            },
            "aiRulesets": {
              "type": "array",
              "items": { "$ref": "#/definitions/repositoryPath" },
              "uniqueItems": true,
              "description": "AI-consumable rulesets and context artifacts for this topology."
            },
            "umsContracts": {
              "type": "array",
              "items": { "$ref": "#/definitions/repositoryPath" },
              "uniqueItems": true,
              "description": "Technical UMS contract references related to this topology."
            }
          }
        },
        "operationalInterfaces": {
          "type": "object",
          "required": ["cli", "mcp", "coreApi"],
          "additionalProperties": false,
          "properties": {
            "cli": {
              "type": "object",
              "required": ["validators"],
              "additionalProperties": false,
              "properties": {
                "validators": {
                  "type": "array",
                  "items": { "$ref": "#/definitions/kebabIdentifier" },
                  "uniqueItems": true,
                  "description": "CLI validators that can resolve this topology."
                }
              }
            },
            "mcp": {
              "type": "object",
              "required": ["resources", "tools", "prompts"],
              "additionalProperties": false,
              "properties": {
                "resources": {
                  "type": "array",
                  "items": { "$ref": "#/definitions/mcpUri" },
                  "uniqueItems": true
                },
                "tools": {
                  "type": "array",
                  "items": { "$ref": "#/definitions/kebabIdentifier" },
                  "uniqueItems": true
                },
                "prompts": {
                  "type": "array",
                  "items": { "$ref": "#/definitions/kebabIdentifier" },
                  "uniqueItems": true
                }
              }
            },
            "coreApi": {
              "type": "object",
              "required": ["endpoints"],
              "additionalProperties": false,
              "properties": {
                "endpoints": {
                  "type": "array",
                  "items": {
                    "type": "string",
                    "pattern": "^(GET|POST) /[a-z0-9/:{}-]+$"
                  },
                  "uniqueItems": true,
                  "description": "Service CORE API read or validation endpoints that expose this topology."
                }
              }
            }
          }
        }
      }
    },
    "businessBoundary": {
      "type": "object",
      "required": ["technicalOnly", "trackerOwns"],
      "additionalProperties": false,
      "properties": {
        "technicalOnly": {
          "type": "boolean",
          "const": true,
          "description": "Topology manifests are Phase 1 technical ideation artifacts and must not contain business data."
        },
        "trackerOwns": {
          "type": "array",
          "items": {
            "type": "string",
            "enum": ["timing", "ownership", "prioritization", "roi", "cost", "budget", "funnel-0"]
          },
          "uniqueItems": true,
          "minItems": 7,
          "maxItems": 7,
          "description": "Business concerns reserved for Evolith Tracker via ACL and Funnel 0."
        }
      }
    }
  },
  "definitions": {
    "repositoryPath": {
      "type": "string",
      "pattern": "^(reference|rulesets|packages|sdk|apps)/[A-Za-z0-9._/-]+$",
      "description": "Repository-relative path without leading slash."
    },
    "kebabIdentifier": {
      "type": "string",
      "pattern": "^[a-z0-9]+(?:-[a-z0-9]+)*$"
    },
    "mcpUri": {
      "type": "string",
      "pattern": "^evolith://[a-z0-9/{}/:-]+$"
    }
  }
}
